Eat-Drink-Man-Woman,'Bigger than cats': Ang Mo Kio market's war on rodents sees authorities exterminate rats in 6-hour operation,https://forums.hardwarezone.com.sg/threads/bigger-than-cats-ang-mo-kio-markets-war-on-rodents-sees-authorities-exterminate-rats-in-6-hour-operation.6596507/,ang mo kio,"Sep 11, 2021"
Eat-Drink-Man-Woman,Daiso is opening in Ang Mo kio,https://forums.hardwarezone.com.sg/threads/daiso-is-opening-in-ang-mo-kio.6798141/,ang mo kio,"Aug 22, 2022"
Eat-Drink-Man-Woman,Ang Mo Kio Street 23 alleged murder - Friend says woman told her she was pregnant,https://forums.hardwarezone.com.sg/threads/ang-mo-kio-street-23-alleged-murder-friend-says-woman-told-her-she-was-pregnant.6677738/page-4,ang mo kio,"Jan 12, 2022"
Eat-Drink-Man-Woman,"ST: Woman dies after being hit by taxi in Ang Mo Kio, allegedly dragged for 20m",https://forums.hardwarezone.com.sg/threads/st-woman-dies-after-being-hit-by-taxi-in-ang-mo-kio-allegedly-dragged-for-20m.6768622/,ang mo kio,"Jun 21, 2022"
Eat-Drink-Man-Woman,4 HDB blocks in Ang Mo Kio identified for HDB SERS scheme; first such announcement in nearly 4 years,https://forums.hardwarezone.com.sg/threads/4-hdb-blocks-in-ang-mo-kio-identified-for-hdb-sers-scheme-first-such-announcement-in-nearly-4-years.6728421/,ang mo kio,"Apr 7, 2022"
Eat-Drink-Man-Woman,"46yo pedestrian dies, bus driver arrested in Ang Mo Kio accident",https://forums.hardwarezone.com.sg/threads/46yo-pedestrian-dies-bus-driver-arrested-in-ang-mo-kio-accident.6585043/,ang mo kio,"Aug 25, 2021"
Eat-Drink-Man-Woman,Why is there no Ang Mo Kio Ave 7 and Ave 11?,https://forums.hardwarezone.com.sg/threads/why-is-there-no-ang-mo-kio-ave-7-and-ave-11.6446732/,ang mo kio,"Jan 12, 2021"
Eat-Drink-Man-Woman,Ang Mo Kio Street 23 alleged murder - Friend says woman told her she was pregnant,https://forums.hardwarezone.com.sg/threads/ang-mo-kio-street-23-alleged-murder-friend-says-woman-told-her-she-was-pregnant.6677738/page-18,ang mo kio,"Jan 12, 2022"
HomeSeekers and HomeMakers,Will new condo in Ang Mo Kio Ave 1 a good buy?,https://forums.hardwarezone.com.sg/threads/will-new-condo-in-ang-mo-kio-ave-1-a-good-buy.6634094/,ang mo kio,"Nov 2, 2021"
Eat-Drink-Man-Woman,Ang Mo Kio Street 23 alleged murder - Friend says woman told her she was pregnant,https://forums.hardwarezone.com.sg/threads/ang-mo-kio-street-23-alleged-murder-friend-says-woman-told-her-she-was-pregnant.6677738/page-32,ang mo kio,"Jan 12, 2022"
Eat-Drink-Man-Woman,Man's finger amputated after getting slashed with parang in Ang Mo Kio dispute,https://forums.hardwarezone.com.sg/threads/mans-finger-amputated-after-getting-slashed-with-parang-in-ang-mo-kio-dispute.6710757/,ang mo kio,"Mar 7, 2022"
Eat-Drink-Man-Woman,Ang Mo Kio Street 23 alleged murder - Friend says woman told her she was pregnant,https://forums.hardwarezone.com.sg/threads/ang-mo-kio-street-23-alleged-murder-friend-says-woman-told-her-she-was-pregnant.6677738/page-11,ang mo kio,"Jan 12, 2022"
Eat-Drink-Man-Woman,Is Ang Mo Kio so badly infected?,https://forums.hardwarezone.com.sg/threads/is-ang-mo-kio-so-badly-infected.6564925/,ang mo kio,"Jul 26, 2021"
Eat-Drink-Man-Woman,"[GVGT]Residents of Ang Mo Kio Blk 562-565 bay song with their SERS, and farking someone non stop LOL",https://forums.hardwarezone.com.sg/threads/gvgt-residents-of-ang-mo-kio-blk-562-565-bay-song-with-their-sers-and-farking-someone-non-stop-lol.6773949/,ang mo kio,"Jul 3, 2022"
Eat-Drink-Man-Woman,Ang Mo Kio Street 23 alleged murder - Friend says woman told her she was pregnant,https://forums.hardwarezone.com.sg/threads/ang-mo-kio-street-23-alleged-murder-friend-says-woman-told-her-she-was-pregnant.6677738/page-5,ang mo kio,"Jan 12, 2022"
Eat-Drink-Man-Woman,GVGT: Conditions in ITE Ang Mo Kio quarantine facility,https://forums.hardwarezone.com.sg/threads/gvgt-conditions-in-ite-ang-mo-kio-quarantine-facility.6612417/,ang mo kio,"Oct 2, 2021"
Eat-Drink-Man-Woman,Ang Mo Kio SERS the new replacement flat for 4 room flat is 80 m²,https://forums.hardwarezone.com.sg/threads/ang-mo-kio-sers-the-new-replacement-flat-for-4-room-flat-is-80-m.6728743/,ang mo kio,"Apr 7, 2022"
Eat-Drink-Man-Woman,"Ang Mo Kio Sers: New options of replacement flats with shorter leases of 50 years or less, says HDB letter to residents",https://forums.hardwarezone.com.sg/threads/ang-mo-kio-sers-new-options-of-replacement-flats-with-shorter-leases-of-50-years-or-less-says-hdb-letter-to-residents.6773310/,ang mo kio,"Jul 2, 2022"
Eat-Drink-Man-Woman,Naked man apprehended after trying to 'harass' onlookers in Ang Mo Kio,https://forums.hardwarezone.com.sg/threads/naked-man-apprehended-after-trying-to-harass-onlookers-in-ang-mo-kio.6773307/page-8,ang mo kio,"Jul 2, 2022"
Eat-Drink-Man-Woman,Ang Mo Kio SERS project: Elderly couple troubled as they've to fork out money for replacement flat,https://forums.hardwarezone.com.sg/threads/ang-mo-kio-sers-project-elderly-couple-troubled-as-theyve-to-fork-out-money-for-replacement-flat.6763157/,ang mo kio,"Jun 11, 2022"
Eat-Drink-Man-Woman,"Poor conditions at Ang Mo Kio community care facility rectified several weeks ago; some areas to be improved: MOM, MOH",https://forums.hardwarezone.com.sg/threads/poor-conditions-at-ang-mo-kio-community-care-facility-rectified-several-weeks-ago-some-areas-to-be-improved-mom-moh.6613872/,ang mo kio,"Oct 5, 2021"
Eat-Drink-Man-Woman,Is Ang Mo Kio a poor or rich slum?,https://forums.hardwarezone.com.sg/threads/is-ang-mo-kio-a-poor-or-rich-slum.6681167/page-2,ang mo kio,"Jan 18, 2022"
Eat-Drink-Man-Woman,Is Ang Mo Kio a poor or rich slum?,https://forums.hardwarezone.com.sg/threads/is-ang-mo-kio-a-poor-or-rich-slum.6681167/page-3,ang mo kio,"Jan 18, 2022"
HomeSeekers and HomeMakers,"AMK Ave 1 GLS closes at top-bid 1,118 ppr",https://forums.hardwarezone.com.sg/threads/amk-ave-1-gls-closes-at-top-bid-1-118-ppr.6524372/,ang mo kio,"May 26, 2021"
Eat-Drink-Man-Woman,Desmond Lee: I met some residents affected by the Ang Mo Kio SERS exercise over the weekend together with HDB colleagues...,https://forums.hardwarezone.com.sg/threads/desmond-lee-i-met-some-residents-affected-by-the-ang-mo-kio-sers-exercise-over-the-weekend-together-with-hdb-colleagues.6774691/,ang mo kio,"Jul 5, 2022"
Eat-Drink-Man-Woman,'Doesn't really make a difference': Ang Mo Kio SERS residents shrug at chance to apply for BTO flat in the estate,https://forums.hardwarezone.com.sg/threads/doesnt-really-make-a-difference-ang-mo-kio-sers-residents-shrug-at-chance-to-apply-for-bto-flat-in-the-estate.6792017/,ang mo kio,"Aug 8, 2022"
Eat-Drink-Man-Woman,All residents at Ang Mo Kio block to undergo mandatory COVID-19 testing after 9 cases detected,https://forums.hardwarezone.com.sg/threads/all-residents-at-ang-mo-kio-block-to-undergo-mandatory-covid-19-testing-after-9-cases-detected.6587177/,ang mo kio,"Aug 28, 2021"
Eat-Drink-Man-Woman,"Mum of 5 loses $1.9k cash in Ang Mo Kio, only has $0.60 left in bank account now",https://forums.hardwarezone.com.sg/threads/mum-of-5-loses-1-9k-cash-in-ang-mo-kio-only-has-0-60-left-in-bank-account-now.6788891/,ang mo kio,"Aug 2, 2022"
Eat-Drink-Man-Woman,Inflation or robbery? $11 'cai fan' from Ang Mo Kio coffee shop sparks debate among netizens,https://forums.hardwarezone.com.sg/threads/inflation-or-robbery-11-cai-fan-from-ang-mo-kio-coffee-shop-sparks-debate-among-netizens.6766159/,ang mo kio,"Jun 16, 2022"
Eat-Drink-Man-Woman,Ang Mo Kio Has Grab-All-You-Can Electronics ‘Heist’ That Includes Phones & Tablets from $55/15mins kym,https://forums.hardwarezone.com.sg/threads/ang-mo-kio-has-grab-all-you-can-electronics-heist-that-includes-phones-tablets-from-55-15mins-kym.6635849/,ang mo kio,"Nov 5, 2021"
Eat-Drink-Man-Woman,"ST: Woman dies after being hit by taxi in Ang Mo Kio, allegedly dragged for 20m",https://forums.hardwarezone.com.sg/threads/st-woman-dies-after-being-hit-by-taxi-in-ang-mo-kio-allegedly-dragged-for-20m.6768622/page-4,ang mo kio,"Jun 21, 2022"
Eat-Drink-Man-Woman,"[GVGT]Residents of Ang Mo Kio Blk 562-565 bay song with their SERS, and farking someone non stop LOL",https://forums.hardwarezone.com.sg/threads/gvgt-residents-of-ang-mo-kio-blk-562-565-bay-song-with-their-sers-and-farking-someone-non-stop-lol.6773949/page-3,ang mo kio,"Jul 3, 2022"
Eat-Drink-Man-Woman,"[GVGT]Residents of Ang Mo Kio Blk 562-565 bay song with their SERS, and farking someone non stop LOL",https://forums.hardwarezone.com.sg/threads/gvgt-residents-of-ang-mo-kio-blk-562-565-bay-song-with-their-sers-and-farking-someone-non-stop-lol.6773949/page-7,ang mo kio,"Jul 3, 2022"
Eat-Drink-Man-Woman,"Ang mo kio SERS exercise, all HDB owner will encounter it when their flat lease is less then 30 years",https://forums.hardwarezone.com.sg/threads/ang-mo-kio-sers-exercise-all-hdb-owner-will-encounter-it-when-their-flat-lease-is-less-then-30-years.6765163/,ang mo kio,"Jun 14, 2022"
Eat-Drink-Man-Woman,What so good about the location in Ang Mo Kio? So many people willing to offer 400K to S$1 million to live there?,https://forums.hardwarezone.com.sg/threads/what-so-good-about-the-location-in-ang-mo-kio-so-many-people-willing-to-offer-400k-to-s-1-million-to-live-there.6804150/,ang mo kio,"Sep 3, 2022"
Eat-Drink-Man-Woman,"Ang Mo Kio SERS: Residents upset with having to top up money, say “how many more years must I actually work to pay off all my debts?”",https://forums.hardwarezone.com.sg/threads/ang-mo-kio-sers-residents-upset-with-having-to-top-up-money-say-how-many-more-years-must-i-actually-work-to-pay-off-all-my-debts.6782073/,ang mo kio,"Jul 20, 2022"
Eat-Drink-Man-Woman,Ang Mo Kio Street 23 alleged murder - Friend says woman told her she was pregnant,https://forums.hardwarezone.com.sg/threads/ang-mo-kio-street-23-alleged-murder-friend-says-woman-told-her-she-was-pregnant.6677738/page-27,ang mo kio,"Jan 12, 2022"
Eat-Drink-Man-Woman,Ang Mo Kio Street 23 alleged murder - Friend says woman told her she was pregnant,https://forums.hardwarezone.com.sg/threads/ang-mo-kio-street-23-alleged-murder-friend-says-woman-told-her-she-was-pregnant.6677738/page-29,ang mo kio,"Jan 12, 2022"
Eat-Drink-Man-Woman,Ang Mo Kio Street 23 alleged murder - Friend says woman told her she was pregnant,https://forums.hardwarezone.com.sg/threads/ang-mo-kio-street-23-alleged-murder-friend-says-woman-told-her-she-was-pregnant.6677738/,ang mo kio,"Jan 12, 2022"
Eat-Drink-Man-Woman,Ang Mo Kio Street 23 alleged murder - Friend says woman told her she was pregnant,https://forums.hardwarezone.com.sg/threads/ang-mo-kio-street-23-alleged-murder-friend-says-woman-told-her-she-was-pregnant.6677738/page-2,ang mo kio,"Jan 12, 2022"
Eat-Drink-Man-Woman,"Ang Mo Kio cat slashings: 37-year-old man arrested, to be charged with animal cruelty",https://forums.hardwarezone.com.sg/threads/ang-mo-kio-cat-slashings-37-year-old-man-arrested-to-be-charged-with-animal-cruelty.6533303/,ang mo kio,"Jun 8, 2021"
Eat-Drink-Man-Woman,Naked man apprehended after trying to 'harass' onlookers in Ang Mo Kio,https://forums.hardwarezone.com.sg/threads/naked-man-apprehended-after-trying-to-harass-onlookers-in-ang-mo-kio.6773307/page-2,ang mo kio,"Jul 2, 2022"
Eat-Drink-Man-Woman,Anyone been to AMK Blk 532 area ?,https://forums.hardwarezone.com.sg/threads/anyone-been-to-amk-blk-532-area.5287984/page-304,ang mo kio,"Jan 23, 2016"
HomeSeekers and HomeMakers,Will new condo in Ang Mo Kio Ave 1 a good buy?,https://forums.hardwarezone.com.sg/threads/will-new-condo-in-ang-mo-kio-ave-1-a-good-buy.6634094/page-4,ang mo kio,"Nov 2, 2021"
Eat-Drink-Man-Woman,"[GVGT]Residents of Ang Mo Kio Blk 562-565 bay song with their SERS, and farking someone non stop LOL",https://forums.hardwarezone.com.sg/threads/gvgt-residents-of-ang-mo-kio-blk-562-565-bay-song-with-their-sers-and-farking-someone-non-stop-lol.6773949/page-5,ang mo kio,"Jul 3, 2022"
Current Affairs Lounge,[OFFICIAL - GE2020] Ang Mo Kio GRC discussions,https://forums.hardwarezone.com.sg/threads/official-ge2020-ang-mo-kio-grc-discussions.6316476/,ang mo kio,"Jun 24, 2020"
Eat-Drink-Man-Woman,"An MRT ride from Pasir Ris to Ang Mo Kio in 25 minutes? It’s possible with the Cross Island Line,",https://forums.hardwarezone.com.sg/threads/an-mrt-ride-from-pasir-ris-to-ang-mo-kio-in-25-minutes-its-possible-with-the-cross-island-line.6503600/,ang mo kio,"Apr 26, 2021"
Eat-Drink-Man-Woman,Ang Mo Kio open pasar malam today,https://forums.hardwarezone.com.sg/threads/ang-mo-kio-open-pasar-malam-today.6729805/,ang mo kio,"Apr 9, 2022"
HomeSeekers and HomeMakers,[BTO] AMK COURT,https://forums.hardwarezone.com.sg/threads/bto-amk-court.5386506/page-5,ang mo kio,"Jun 4, 2016"
Current Affairs Lounge,S&CC rate for Ang Mo Kio TC is 18% higher than Aljunied TC’s,https://forums.hardwarezone.com.sg/threads/s-cc-rate-for-ang-mo-kio-tc-is-18-higher-than-aljunied-tcs.4223724/,ang mo kio,"May 23, 2013"
Eat-Drink-Man-Woman,4 HDB blocks in Ang Mo Kio identified for HDB SERS scheme; first such announcement in nearly 4 years,https://forums.hardwarezone.com.sg/threads/4-hdb-blocks-in-ang-mo-kio-identified-for-hdb-sers-scheme-first-such-announcement-in-nearly-4-years.6728421/page-7,ang mo kio,"Apr 7, 2022"
Eat-Drink-Man-Woman,"Ang Mo Kio salon shuts after S'poreans buy over S$40,000 worth of nail services",https://forums.hardwarezone.com.sg/threads/ang-mo-kio-salon-shuts-after-sporeans-buy-over-s-40-000-worth-of-nail-services.6769274/,ang mo kio,"Jun 23, 2022"
Eat-Drink-Man-Woman,'I gave them a scolding the first time': Ang Mo Kio residents on HDB officers doing door-to-door visits regarding Sers,https://forums.hardwarezone.com.sg/threads/i-gave-them-a-scolding-the-first-time-ang-mo-kio-residents-on-hdb-officers-doing-door-to-door-visits-regarding-sers.6778178/,ang mo kio,"Jul 12, 2022"
Eat-Drink-Man-Woman,Man stands in Ang Mo Kio car park lot for 5 mins at dinner time to reserve it for BMW,https://forums.hardwarezone.com.sg/threads/man-stands-in-ang-mo-kio-car-park-lot-for-5-mins-at-dinner-time-to-reserve-it-for-bmw.6685536/,ang mo kio,"Jan 26, 2022"
Eat-Drink-Man-Woman,Really can't please everyone. Now amk sers residents given priority bto chances in Ang Moh kio,https://forums.hardwarezone.com.sg/threads/really-cant-please-everyone-now-amk-sers-residents-given-priority-bto-chances-in-ang-moh-kio.6791309/,ang mo kio,"Aug 7, 2022"
Eat-Drink-Man-Woman,Ang Mo Kio cat slasher jailed 12 weeks for animal cruelty,https://forums.hardwarezone.com.sg/threads/ang-mo-kio-cat-slasher-jailed-12-weeks-for-animal-cruelty.6556355/,ang mo kio,"Jul 15, 2021"
Eat-Drink-Man-Woman,Bloodstained tissues and ART kit thrown down Ang Mo Kio block,https://forums.hardwarezone.com.sg/threads/bloodstained-tissues-and-art-kit-thrown-down-ang-mo-kio-block.6698348/,ang mo kio,"Feb 16, 2022"
Eat-Drink-Man-Woman,4 HDB blocks in Ang Mo Kio identified for HDB SERS scheme; first such announcement in nearly 4 years,https://forums.hardwarezone.com.sg/threads/4-hdb-blocks-in-ang-mo-kio-identified-for-hdb-sers-scheme-first-such-announcement-in-nearly-4-years.6728421/page-8,ang mo kio,"Apr 7, 2022"
Eat-Drink-Man-Woman,Is Ang Mo Kio so badly infected?,https://forums.hardwarezone.com.sg/threads/is-ang-mo-kio-so-badly-infected.6564925/page-2,ang mo kio,"Jul 26, 2021"
Eat-Drink-Man-Woman,Facebook page to get correction order after implying HDB will profit from Ang Mo Kio BTO flats,https://forums.hardwarezone.com.sg/threads/facebook-page-to-get-correction-order-after-implying-hdb-will-profit-from-ang-mo-kio-bto-flats.6804502/,ang mo kio,"Sep 4, 2022"
Eat-Drink-Man-Woman,[Updated] New Cradle Style Fashion at AMK CLOSED,https://forums.hardwarezone.com.sg/threads/updated-new-cradle-style-fashion-at-amk-closed.6605146/,ang mo kio,"Sep 23, 2021"
Eat-Drink-Man-Woman,Ang Mo Kio uncle lies on ground in heavy rain to feel the rain on his skin,https://forums.hardwarezone.com.sg/threads/ang-mo-kio-uncle-lies-on-ground-in-heavy-rain-to-feel-the-rain-on-his-skin.6768033/,ang mo kio,"Jun 20, 2022"
Eat-Drink-Man-Woman,GPGT: Another case of neighbour from hell in Ang Mo Kio GRC,https://forums.hardwarezone.com.sg/threads/gpgt-another-case-of-neighbour-from-hell-in-ang-mo-kio-grc.6647881/,ang mo kio,"Nov 25, 2021"
Eat-Drink-Man-Woman,"New Muslim-friendly coffeeshop in AMK has air-conditioned musollah, offers thin-crust pizza & Bandung Grenade",https://forums.hardwarezone.com.sg/threads/new-muslim-friendly-coffeeshop-in-amk-has-air-conditioned-musollah-offers-thin-crust-pizza-bandung-grenade.6742722/,ang mo kio,"May 2, 2022"
Eat-Drink-Man-Woman,HDB exploring options to assist AMK families who need to top up $ for similar-sized replacement flats...,https://forums.hardwarezone.com.sg/threads/hdb-exploring-options-to-assist-amk-families-who-need-to-top-up-for-similar-sized-replacement-flats.6765276/,ang mo kio,"Jun 15, 2022"
Cars & Cars,Ang Mo Kio Car Workshop,https://forums.hardwarezone.com.sg/threads/ang-mo-kio-car-workshop.5088591/,ang mo kio,"Jun 24, 2015"
Eat-Drink-Man-Woman,"Owners of Ang Mo Kio flats selected for SERS put units up for sale, hoping to cash in",https://forums.hardwarezone.com.sg/threads/owners-of-ang-mo-kio-flats-selected-for-sers-put-units-up-for-sale-hoping-to-cash-in.6761159/,ang mo kio,"Jun 7, 2022"
Eat-Drink-Man-Woman,4 HDB blocks in Ang Mo Kio identified for HDB SERS scheme; first such announcement in nearly 4 years,https://forums.hardwarezone.com.sg/threads/4-hdb-blocks-in-ang-mo-kio-identified-for-hdb-sers-scheme-first-such-announcement-in-nearly-4-years.6728421/page-6,ang mo kio,"Apr 7, 2022"
Eat-Drink-Man-Woman,NewsFlash| 39-year-old woman arrested for murder after death of man with multiple wounds at AMK Ave 3,https://forums.hardwarezone.com.sg/threads/newsflash-39-year-old-woman-arrested-for-murder-after-death-of-man-with-multiple-wounds-at-amk-ave-3.6556146/,ang mo kio,"Jul 15, 2021"
Eat-Drink-Man-Woman,These guys performed parkour at Ang Mo Kio. Guess who was watching them?,https://forums.hardwarezone.com.sg/threads/these-guys-performed-parkour-at-ang-mo-kio-guess-who-was-watching-them.6774353/,ang mo kio,"Jul 4, 2022"
Eat-Drink-Man-Woman,AMK Nake woman anyhow run 🏃‍♀️🏃‍♀️🏃‍♀️,https://forums.hardwarezone.com.sg/threads/amk-nake-woman-anyhow-run.6774922/page-3,ang mo kio,"Jul 5, 2022"
Eat-Drink-Man-Woman,Only 1 in 5 Ang Mo Kio SERS households have applied for new flats: HDB,https://forums.hardwarezone.com.sg/threads/only-1-in-5-ang-mo-kio-sers-households-have-applied-for-new-flats-hdb.6809998/,ang mo kio,"Sep 16, 2022"
Eat-Drink-Man-Woman,"PM Lee visits residents in Ang Mo Kio to deliver red packets, gifts ahead of CNY",https://forums.hardwarezone.com.sg/threads/pm-lee-visits-residents-in-ang-mo-kio-to-deliver-red-packets-gifts-ahead-of-cny.6683491/,ang mo kio,"Jan 22, 2022"
Eat-Drink-Man-Woman,UNIQLO to open five new stores in Singapore including Ang Mo Kio and Clementi,https://forums.hardwarezone.com.sg/threads/uniqlo-to-open-five-new-stores-in-singapore-including-ang-mo-kio-and-clementi.6698253/,ang mo kio,"Feb 16, 2022"
Eat-Drink-Man-Woman,Collin's at Ang Mo Kio Jubilee Square suspended 2 weeks for failure to keep premises clean,https://forums.hardwarezone.com.sg/threads/collins-at-ang-mo-kio-jubilee-square-suspended-2-weeks-for-failure-to-keep-premises-clean.6585602/,ang mo kio,"Aug 26, 2021"
Eat-Drink-Man-Woman,"S$30 from Orchard to Ang Mo Kio: Companies introducing incentives to attract more drivers, commuters frustrated over 'crazy' fare hikes",https://forums.hardwarezone.com.sg/threads/s-30-from-orchard-to-ang-mo-kio-companies-introducing-incentives-to-attract-more-drivers-commuters-frustrated-over-crazy-fare-hikes.6744326/,ang mo kio,"May 5, 2022"
Eat-Drink-Man-Woman,Mandatory Covid-19 testing for residents of 456 Ang Mo Kio Ave 10 & 340 Clementi Ave 5,https://forums.hardwarezone.com.sg/threads/mandatory-covid-19-testing-for-residents-of-456-ang-mo-kio-ave-10-340-clementi-ave-5.6563615/,ang mo kio,"Jul 24, 2021"
Eat-Drink-Man-Woman,Sers flat owners in Ang Mo Kio welcome shorter lease,https://forums.hardwarezone.com.sg/threads/sers-flat-owners-in-ang-mo-kio-welcome-shorter-lease.6776361/,ang mo kio,"Jul 8, 2022"
Eat-Drink-Man-Woman,PRC v PRC at Ang Mo Kio Coffeeshop,https://forums.hardwarezone.com.sg/threads/prc-v-prc-at-ang-mo-kio-coffeeshop.6788236/,ang mo kio,"Aug 1, 2022"
Eat-Drink-Man-Woman,What's the best restaurant in Ang Mo Kio ?,https://forums.hardwarezone.com.sg/threads/whats-the-best-restaurant-in-ang-mo-kio.6457194/,ang mo kio,"Jan 30, 2021"
HomeSeekers and HomeMakers,Will new condo in Ang Mo Kio Ave 1 a good buy?,https://forums.hardwarezone.com.sg/threads/will-new-condo-in-ang-mo-kio-ave-1-a-good-buy.6634094/page-2,ang mo kio,"Nov 2, 2021"
Eat-Drink-Man-Woman,Two people taken to hospital after fire in Ang Mo Kio flat,https://forums.hardwarezone.com.sg/threads/two-people-taken-to-hospital-after-fire-in-ang-mo-kio-flat.6765180/,ang mo kio,"Jun 14, 2022"
Eat-Drink-Man-Woman,Two taken to hospital after fire breaks out at Ang Mo Kio HDB flat,https://forums.hardwarezone.com.sg/threads/two-taken-to-hospital-after-fire-breaks-out-at-ang-mo-kio-hdb-flat.6765030/,ang mo kio,"Jun 14, 2022"
Eat-Drink-Man-Woman,[GTTGT] JIUHU BU SEXPOSED ANG MO KIO LANDLORD,https://forums.hardwarezone.com.sg/threads/gttgt-jiuhu-bu-sexposed-ang-mo-kio-landlord.6650790/page-2,ang mo kio,"Nov 30, 2021"
Eat-Drink-Man-Woman,1 in 5 Ang Mo Kio Sers households have applied for new flats: HDB,https://forums.hardwarezone.com.sg/threads/1-in-5-ang-mo-kio-sers-households-have-applied-for-new-flats-hdb.6810229/,ang mo kio,"Sep 16, 2022"
Eat-Drink-Man-Woman,Ang Mo Kio ward aims to train community to tackle seniors' mental health issues,https://forums.hardwarezone.com.sg/threads/ang-mo-kio-ward-aims-to-train-community-to-tackle-seniors-mental-health-issues.6658641/,ang mo kio,"Dec 12, 2021"
Eat-Drink-Man-Woman,Is Ang Mo Kio a poor or rich slum?,https://forums.hardwarezone.com.sg/threads/is-ang-mo-kio-a-poor-or-rich-slum.6681167/,ang mo kio,"Jan 18, 2022"
Current Affairs Lounge,[Official]Ang Mo Kio GRC discussion thread...,https://forums.hardwarezone.com.sg/threads/official-ang-mo-kio-grc-discussion-thread.5156208/,ang mo kio,"Sep 1, 2015"
Eat-Drink-Man-Woman,GVGT: Conditions in ITE Ang Mo Kio quarantine facility,https://forums.hardwarezone.com.sg/threads/gvgt-conditions-in-ite-ang-mo-kio-quarantine-facility.6612417/page-2,ang mo kio,"Oct 2, 2021"
Eat-Drink-Man-Woman,Ang Mo Kio Nonya Kueh — one of the 9 kueh manufacturers ordered to be suspended by SFA — has come out to address its customers publicly on Friday.,https://forums.hardwarezone.com.sg/threads/ang-mo-kio-nonya-kueh-one-of-the-9-kueh-manufacturers-ordered-to-be-suspended-by-sfa-has-come-out-to-address-its-customers-publicly-on-friday.6786981/,ang mo kio,"Jul 29, 2022"
Eat-Drink-Man-Woman,GXGX. even bedok condo Sky Eden@Bedok gonna start from $2k psf.,https://forums.hardwarezone.com.sg/threads/gxgx-even-bedok-condo-sky-eden-bedok-gonna-start-from-2k-psf.6799463/,bedok,"Aug 25, 2022"
Eat-Drink-Man-Woman,Fire at Bedok North St 1 near Djitsun Mall.,https://forums.hardwarezone.com.sg/threads/fire-at-bedok-north-st-1-near-djitsun-mall.6686853/,bedok,"Jan 29, 2022"
Eat-Drink-Man-Woman,"Bedok Point mall, faced with stiff competition, to make way for residential-commercial development",https://forums.hardwarezone.com.sg/threads/bedok-point-mall-faced-with-stiff-competition-to-make-way-for-residential-commercial-development.6547241/,bedok,"Jul 1, 2021"
Eat-Drink-Man-Woman,[Bedok kias] Song bo?,https://forums.hardwarezone.com.sg/threads/bedok-kias-song-bo.6458402/,bedok,"Feb 2, 2021"
Eat-Drink-Man-Woman,3 residents die in Bedok North flat fire,https://forums.hardwarezone.com.sg/threads/3-residents-die-in-bedok-north-flat-fire.6748213/,bedok,"May 13, 2022"
HomeSeekers and HomeMakers,NOV 2016 - Bedok Becon/North Vale/South Horizon BTO,https://forums.hardwarezone.com.sg/threads/nov-2016-bedok-becon-north-vale-south-horizon-bto.5545322/page-79,bedok,"Jan 12, 2017"
HomeSeekers and HomeMakers,Waterfront collections / bedok reservoir your thoughts?,https://forums.hardwarezone.com.sg/threads/waterfront-collections-bedok-reservoir-your-thoughts.6696684/,bedok,"Feb 13, 2022"
Eat-Drink-Man-Woman,Any Bedok kia here in edmw?,https://forums.hardwarezone.com.sg/threads/any-bedok-kia-here-in-edmw.6423361/page-42,bedok,"Dec 6, 2020"
HomeSeekers and HomeMakers,NOV 2016 - Bedok Becon/North Vale/South Horizon BTO,https://forums.hardwarezone.com.sg/threads/nov-2016-bedok-becon-north-vale-south-horizon-bto.5545322/,bedok,"Jan 12, 2017"
National Service Knowledge-Base,Why cannot enter Bedok Camp to buy from Emart,https://forums.hardwarezone.com.sg/threads/why-cannot-enter-bedok-camp-to-buy-from-emart.5848581/,bedok,"Jun 13, 2018"
Eat-Drink-Man-Woman,Anyone dare to buy this house at Bedok?,https://forums.hardwarezone.com.sg/threads/anyone-dare-to-buy-this-house-at-bedok.6679652/,bedok,"Jan 16, 2022"
Eat-Drink-Man-Woman,Bedok where is fireworks tonite?,https://forums.hardwarezone.com.sg/threads/bedok-where-is-fireworks-tonite.6438944/,bedok,"Dec 31, 2020"
Eat-Drink-Man-Woman,3 residents die in Bedok North flat fire,https://forums.hardwarezone.com.sg/threads/3-residents-die-in-bedok-north-flat-fire.6748213/page-11,bedok,"May 13, 2022"
Eat-Drink-Man-Woman,Blk 216 Bedok Hawker Centre is very awesome!,https://forums.hardwarezone.com.sg/threads/blk-216-bedok-hawker-centre-is-very-awesome.6621265/,bedok,"Oct 14, 2021"
Eat-Drink-Man-Woman,[GLGT] 'I dreaded going home': Woman sells Bedok flat to escape from neighbour's noisy parrot,https://forums.hardwarezone.com.sg/threads/glgt-i-dreaded-going-home-woman-sells-bedok-flat-to-escape-from-neighbours-noisy-parrot.6818257/,bedok,Yesterday at 2:43 PM
Eat-Drink-Man-Woman,GPGT at bedok reservoir now,https://forums.hardwarezone.com.sg/threads/gpgt-at-bedok-reservoir-now.6556796/,bedok,"Jul 16, 2021"
