Eat-Drink-Man-Woman,Sembawang Hills Food Centre Dabao Lunch,https://forums.hardwarezone.com.sg/threads/sembawang-hills-food-centre-dabao-lunch.6585156/page-7,sembawang,"Aug 25, 2021"
HomeSeekers and HomeMakers,Tengah BTO VS Sembawang BTO,https://forums.hardwarezone.com.sg/threads/tengah-bto-vs-sembawang-bto.6125206/,sembawang,"Oct 5, 2019"
Eat-Drink-Man-Woman,Man raped daughter in sembawang on appeal accused her of incest in retaliation for her bf,https://forums.hardwarezone.com.sg/threads/man-raped-daughter-in-sembawang-on-appeal-accused-her-of-incest-in-retaliation-for-her-bf.6493279/page-4,sembawang,"Apr 6, 2021"
Eat-Drink-Man-Woman,Will Sembawang GRC fall in the Next GE? OYK's GRC,https://forums.hardwarezone.com.sg/threads/will-sembawang-grc-fall-in-the-next-ge-oyks-grc.6596061/page-2,sembawang,"Sep 10, 2021"
Eat-Drink-Man-Woman,OYK's FB kena f after announcing Sembawang MPS switching to E-MPS,https://forums.hardwarezone.com.sg/threads/oyks-fb-kena-f-after-announcing-sembawang-mps-switching-to-e-mps.6609237/,sembawang,"Sep 28, 2021"
Eat-Drink-Man-Woman,I am deeply disappointed in the voters of Sembawang. Traitors of the nation.,https://forums.hardwarezone.com.sg/threads/i-am-deeply-disappointed-in-the-voters-of-sembawang-traitors-of-the-nation.6604909/,sembawang,"Sep 22, 2021"
HomeSeekers and HomeMakers,May 2013 Sembawang BTO,https://forums.hardwarezone.com.sg/threads/may-2013-sembawang-bto.4283604/page-23,sembawang,"Jul 3, 2013"
HomeSeekers and HomeMakers,July BTO 2014 Sembawang - Sun Natura,https://forums.hardwarezone.com.sg/threads/july-bto-2014-sembawang-sun-natura.4755132/page-31,sembawang,"Jul 25, 2014"
Eat-Drink-Man-Woman,Why Singapore don't want to convert sembawang hotspring spot into a world class onsen attraction hakone style.,https://forums.hardwarezone.com.sg/threads/why-singapore-dont-want-to-convert-sembawang-hotspring-spot-into-a-world-class-onsen-attraction-hakone-style.6697019/,sembawang,"Feb 14, 2022"
Current Affairs Lounge,"Now that NSP has self-destructed, what happens to Tampines GRC, Sembawang GRC and Pioneer SMC?!",https://forums.hardwarezone.com.sg/threads/now-that-nsp-has-self-destructed-what-happens-to-tampines-grc-sembawang-grc-and-pioneer-smc.5144491/,sembawang,"Aug 23, 2015"
Eat-Drink-Man-Woman,I am deeply disappointed in the voters of Sembawang. Traitors of the nation.,https://forums.hardwarezone.com.sg/threads/i-am-deeply-disappointed-in-the-voters-of-sembawang-traitors-of-the-nation.6604909/page-4,sembawang,"Sep 22, 2021"
Eat-Drink-Man-Woman,free gold 财神 charm at sembawang god of wealth temple,https://forums.hardwarezone.com.sg/threads/free-gold-charm-at-sembawang-god-of-wealth-temple.6640461/,sembawang,"Nov 13, 2021"
Eat-Drink-Man-Woman,Sembawang MP Poh Li San elected unopposed as STTA president,https://forums.hardwarezone.com.sg/threads/sembawang-mp-poh-li-san-elected-unopposed-as-stta-president.6801840/,sembawang,"Aug 30, 2022"
Eat-Drink-Man-Woman,Minister Ong: Sembawang is one of the few places in Singapore with residential units at the waterfront...,https://forums.hardwarezone.com.sg/threads/minister-ong-sembawang-is-one-of-the-few-places-in-singapore-with-residential-units-at-the-waterfront.6708219/,sembawang,"Mar 3, 2022"
Eat-Drink-Man-Woman,"Ong Ye Kung takes trip around Sembawang on Bus 75S, interviews 'inspirational people'",https://forums.hardwarezone.com.sg/threads/ong-ye-kung-takes-trip-around-sembawang-on-bus-75s-interviews-inspirational-people.6577731/page-3,sembawang,"Aug 13, 2021"
Eat-Drink-Man-Woman,"Children play 'Squid Game' Red Light, Green Light in Sembawang, pretend to shoot anyone who moves",https://forums.hardwarezone.com.sg/threads/children-play-squid-game-red-light-green-light-in-sembawang-pretend-to-shoot-anyone-who-moves.6619353/,sembawang,"Oct 11, 2021"
Eat-Drink-Man-Woman,Cook chicken wing at sembawang hot spring... kym?,https://forums.hardwarezone.com.sg/threads/cook-chicken-wing-at-sembawang-hot-spring-kym.6503442/,sembawang,"Apr 26, 2021"
HomeSeekers and HomeMakers,July BTO 2014 Sembawang - Sun Natura,https://forums.hardwarezone.com.sg/threads/july-bto-2014-sembawang-sun-natura.4755132/page-8,sembawang,"Jul 25, 2014"
Eat-Drink-Man-Woman,Fire engulfs Sembawang God of Wealth leaves God untouched,https://forums.hardwarezone.com.sg/threads/fire-engulfs-sembawang-god-of-wealth-leaves-god-untouched.6378058/page-19,sembawang,"Sep 18, 2020"
"The ""Makan"" Zone",Food recommendations for Sembawang,https://forums.hardwarezone.com.sg/threads/food-recommendations-for-sembawang.6653558/,sembawang,"Dec 4, 2021"
Eat-Drink-Man-Woman,"Man, 19, arrested after allegedly exposing his genitals to woman in Sembawang",https://forums.hardwarezone.com.sg/threads/man-19-arrested-after-allegedly-exposing-his-genitals-to-woman-in-sembawang.6812009/,sembawang,"Sep 20, 2022"
Eat-Drink-Man-Woman,Twmm go Sembawang hot spring cook chicken wings kana scolding,https://forums.hardwarezone.com.sg/threads/twmm-go-sembawang-hot-spring-cook-chicken-wings-kana-scolding.6503431/,sembawang,"Apr 26, 2021"
Eat-Drink-Man-Woman,"Walk allows Sembawang residents, including Haj pilgrims, to build up fitness",https://forums.hardwarezone.com.sg/threads/walk-allows-sembawang-residents-including-haj-pilgrims-to-build-up-fitness.6763269/,sembawang,"Jun 11, 2022"
Eat-Drink-Man-Woman,I am deeply disappointed in the voters of Sembawang. Traitors of the nation.,https://forums.hardwarezone.com.sg/threads/i-am-deeply-disappointed-in-the-voters-of-sembawang-traitors-of-the-nation.6604909/page-6,sembawang,"Sep 22, 2021"
Eat-Drink-Man-Woman,Fire engulfs Sembawang God of Wealth leaves God untouched,https://forums.hardwarezone.com.sg/threads/fire-engulfs-sembawang-god-of-wealth-leaves-god-untouched.6378058/page-11,sembawang,"Sep 18, 2020"
National Service Knowledge-Base,Supply Supervisor (Sup Supvr) at Sembawang,https://forums.hardwarezone.com.sg/threads/supply-supervisor-sup-supvr-at-sembawang.5692360/page-2,sembawang,"Sep 17, 2017"
Eat-Drink-Man-Woman,Ulu Sembawang Park Connection - jin spooky,https://forums.hardwarezone.com.sg/threads/ulu-sembawang-park-connection-jin-spooky.6798238/page-4,sembawang,"Aug 22, 2022"
Current Affairs Lounge,@PAPSingapore will be unveiling its slate of candidates for Sembawang GRC soon,https://forums.hardwarezone.com.sg/threads/papsingapore-will-be-unveiling-its-slate-of-candidates-for-sembawang-grc-soon.5136112/,sembawang,"Aug 14, 2015"
National Service Knowledge-Base,NS Posting Sup Supvr at Sembawang Camp,https://forums.hardwarezone.com.sg/threads/ns-posting-sup-supvr-at-sembawang-camp.5462982/,sembawang,"Sep 17, 2016"
Eat-Drink-Man-Woman,Sembawang coffeeshop fight sees man attacked by 2 others with plastic chairs & fists,https://forums.hardwarezone.com.sg/threads/sembawang-coffeeshop-fight-sees-man-attacked-by-2-others-with-plastic-chairs-fists.6754805/post-141815779,sembawang,"May 25, 2022"
Eat-Drink-Man-Woman,How can SAF let Johor Sultan visit Sembawang Airbase??,https://forums.hardwarezone.com.sg/threads/how-can-saf-let-johor-sultan-visit-sembawang-airbase.6783375/page-2,sembawang,"Jul 22, 2022"
National Service Knowledge-Base,Sembawang Air Base entrance,https://forums.hardwarezone.com.sg/threads/sembawang-air-base-entrance.4970108/,sembawang,"Feb 16, 2015"
Eat-Drink-Man-Woman,"Sembawang Shipyard, Kent Ridge among sites being studied as part of heritage plan",https://forums.hardwarezone.com.sg/threads/sembawang-shipyard-kent-ridge-among-sites-being-studied-as-part-of-heritage-plan.6760645/,sembawang,"Jun 6, 2022"
HomeSeekers and HomeMakers,New Executive Condo in Sembawang Estate,https://forums.hardwarezone.com.sg/threads/new-executive-condo-in-sembawang-estate.4216164/,sembawang,"May 17, 2013"
Health & Fitness Corner,waterskiing in Sembawang,https://forums.hardwarezone.com.sg/threads/waterskiing-in-sembawang.4435658/,sembawang,"Oct 28, 2013"
Eat-Drink-Man-Woman,Is North side of sg consider slum?,https://forums.hardwarezone.com.sg/threads/is-north-side-of-sg-consider-slum.6568724/,sembawang,"Aug 1, 2021"
Money Mind,Bukit Sembawang : Cooling measures hit Q4 earnings,https://forums.hardwarezone.com.sg/threads/bukit-sembawang-cooling-measures-hit-q4-earnings.4702513/,sembawang,"Jun 7, 2014"
National Service Knowledge-Base,Pes C2 Sembawang Camp,https://forums.hardwarezone.com.sg/threads/pes-c2-sembawang-camp.5432156/,sembawang,"Aug 4, 2016"
Eat-Drink-Man-Woman,sembawang doctor suka2 anyhow chas claim cliniq kenna removed fr participation,https://forums.hardwarezone.com.sg/threads/sembawang-doctor-suka2-anyhow-chas-claim-cliniq-kenna-removed-fr-participation.6779430/,sembawang,"Jul 15, 2022"
Eat-Drink-Man-Woman,"Sembawang 4 room resale selled until $613,000. Sembawang got what thing special?",https://forums.hardwarezone.com.sg/threads/sembawang-4-room-resale-selled-until-613-000-sembawang-got-what-thing-special.6805524/,sembawang,"Sep 6, 2022"
Eat-Drink-Man-Woman,"Sembawang GRC MP suggests reducing bubble tea outlets, pubs and bars",https://forums.hardwarezone.com.sg/threads/sembawang-grc-mp-suggests-reducing-bubble-tea-outlets-pubs-and-bars.6709153/page-9,sembawang,"Mar 4, 2022"
Eat-Drink-Man-Woman,Sembawang GRC to fall to opposition in next GE,https://forums.hardwarezone.com.sg/threads/sembawang-grc-to-fall-to-opposition-in-next-ge.6605047/,sembawang,"Sep 23, 2021"
"The ""Makan"" Zone",any nice food in Sembawang area?,https://forums.hardwarezone.com.sg/threads/any-nice-food-in-sembawang-area.4584516/,sembawang,"Feb 21, 2014"
Eat-Drink-Man-Woman,I am deeply disappointed in the voters of Sembawang. Traitors of the nation.,https://forums.hardwarezone.com.sg/threads/i-am-deeply-disappointed-in-the-voters-of-sembawang-traitors-of-the-nation.6604909/page-2,sembawang,"Sep 22, 2021"
Eat-Drink-Man-Woman,"Sembawang 4 room resale selled until $613,000. Sembawang got what thing special?",https://forums.hardwarezone.com.sg/threads/sembawang-4-room-resale-selled-until-613-000-sembawang-got-what-thing-special.6805524/page-4,sembawang,"Sep 6, 2022"
Eat-Drink-Man-Woman,Ulu Sembawang Park Connection - jin spooky,https://forums.hardwarezone.com.sg/threads/ulu-sembawang-park-connection-jin-spooky.6798238/page-10,sembawang,"Aug 22, 2022"
Cars & Cars,sembawang shopping center carpark,https://forums.hardwarezone.com.sg/threads/sembawang-shopping-center-carpark.5441278/,sembawang,"Aug 17, 2016"
Eat-Drink-Man-Woman,OYK: Joined the Sembawang team today to make calls to residents who are on home recovery.,https://forums.hardwarezone.com.sg/threads/oyk-joined-the-sembawang-team-today-to-make-calls-to-residents-who-are-on-home-recovery.6618330/,sembawang,"Oct 10, 2021"
Eat-Drink-Man-Woman,Sembawang Hills Food Centre Dabao Lunch,https://forums.hardwarezone.com.sg/threads/sembawang-hills-food-centre-dabao-lunch.6585156/page-12,sembawang,"Aug 25, 2021"
Current Affairs Lounge,[OFFICIAL - GE2020] Sembawang GRC discussions,https://forums.hardwarezone.com.sg/threads/official-ge2020-sembawang-grc-discussions.6316550/page-9,sembawang,"Jun 24, 2020"
Eat-Drink-Man-Woman,"damn shocking, i stay sembawang but never see these mps at all, only know oyk",https://forums.hardwarezone.com.sg/threads/damn-shocking-i-stay-sembawang-but-never-see-these-mps-at-all-only-know-oyk.6702269/,sembawang,"Feb 22, 2022"
Eat-Drink-Man-Woman,Financial literacy programme to help Sembawang GRC residents tackle rising cost of living and scams,https://forums.hardwarezone.com.sg/threads/financial-literacy-programme-to-help-sembawang-grc-residents-tackle-rising-cost-of-living-and-scams.6804447/,sembawang,"Sep 4, 2022"
HomeSeekers and HomeMakers,July BTO 2014 Sembawang - Sun Natura,https://forums.hardwarezone.com.sg/homeseekers-homemakers-74/july-bto-2014-sembawang-sun-natura-4755132-3.html,sembawang,"Jul 25, 2014"
"Stocks, Shares and Indices",Bukit Sembawang Estates *Official* (SGX:B61),https://forums.hardwarezone.com.sg/threads/bukit-sembawang-estates-official-sgx-b61.2379893/page-11,sembawang,"May 25, 2009"
Eat-Drink-Man-Woman,Anyone jog at sengkang stadium before,https://forums.hardwarezone.com.sg/threads/anyone-jog-at-sengkang-stadium-before.6525340/,sengkang,"May 27, 2021"
Eat-Drink-Man-Woman,Three new PAP faces in Sengkang GRC,https://forums.hardwarezone.com.sg/threads/three-new-pap-faces-in-sengkang-grc.6722518/,sengkang,"Mar 27, 2022"
Eat-Drink-Man-Woman,PA appoints new advisers to Sengkang Central & East grassroots organisations,https://forums.hardwarezone.com.sg/threads/pa-appoints-new-advisers-to-sengkang-central-east-grassroots-organisations.6728080/,sengkang,"Apr 6, 2022"
Eat-Drink-Man-Woman,Sengkang square kopitiam Carpark Gantry,https://forums.hardwarezone.com.sg/threads/sengkang-square-kopitiam-carpark-gantry.6498430/,sengkang,"Apr 16, 2021"
HomeSeekers and HomeMakers,Pasir Ris 8 Vs SengKang Grand Residences,https://forums.hardwarezone.com.sg/threads/pasir-ris-8-vs-sengkang-grand-residences.6568965/,sengkang,"Aug 1, 2021"
HomeSeekers and HomeMakers,Sengkang residences,https://forums.hardwarezone.com.sg/threads/sengkang-residences.6132603/page-9,sengkang,"Oct 19, 2019"
Eat-Drink-Man-Woman,Three 15-year-old girls involved in the Sengkang carpark brutal beating were arrested...,https://forums.hardwarezone.com.sg/threads/three-15-year-old-girls-involved-in-the-sengkang-carpark-brutal-beating-were-arrested.6796363/page-3,sengkang,"Aug 18, 2022"
Eat-Drink-Man-Woman,anyone been to sengkang kopitiam square?,https://forums.hardwarezone.com.sg/threads/anyone-been-to-sengkang-kopitiam-square.6603099/,sengkang,"Sep 20, 2021"
Eat-Drink-Man-Woman,My friend said next GE2025 Sengkang GRC will go back to PAP,https://forums.hardwarezone.com.sg/threads/my-friend-said-next-ge2025-sengkang-grc-will-go-back-to-pap.6491490/,sengkang,"Apr 2, 2021"
HomeSeekers and HomeMakers,Sengkang residences,https://forums.hardwarezone.com.sg/threads/sengkang-residences.6132603/page-3,sengkang,"Oct 19, 2019"
Eat-Drink-Man-Woman,WP's Sengkang Town Council to manage constituency directly after tender draws no bids,https://forums.hardwarezone.com.sg/threads/wps-sengkang-town-council-to-manage-constituency-directly-after-tender-draws-no-bids.6750775/,sengkang,"May 17, 2022"
Cars & Cars,Red light camera at Sengkang Central,https://forums.hardwarezone.com.sg/threads/red-light-camera-at-sengkang-central.5987382/,sengkang,"Feb 6, 2019"
Eat-Drink-Man-Woman,[mata lai] Woman Throws Eggs At Sengkang Resident’s Door,https://forums.hardwarezone.com.sg/threads/mata-lai-woman-throws-eggs-at-sengkang-residents-door.6787421/,sengkang,"Jul 30, 2022"
Eat-Drink-Man-Woman,"Sengkang Block 295B suspected to be haunted, residents going crazy with mysterious loud bangings",https://forums.hardwarezone.com.sg/threads/sengkang-block-295b-suspected-to-be-haunted-residents-going-crazy-with-mysterious-loud-bangings.6552321/,sengkang,"Jul 9, 2021"
Eat-Drink-Man-Woman,Any prata to recommend at Sengkang,https://forums.hardwarezone.com.sg/threads/any-prata-to-recommend-at-sengkang.6602935/,sengkang,"Sep 20, 2021"
Current Affairs Lounge,[OFFICIAL - GE2020] Sengkang GRC discussions,https://forums.hardwarezone.com.sg/threads/official-ge2020-sengkang-grc-discussions.6316555/,sengkang,"Jun 24, 2020"
Eat-Drink-Man-Woman,Anyone at sengkang smelling **** smell?,https://forums.hardwarezone.com.sg/threads/anyone-at-sengkang-smelling-smell.6654588/,sengkang,"Dec 5, 2021"
Eat-Drink-Man-Woman,Sengkang GRC residents are you ready for a by-election?,https://forums.hardwarezone.com.sg/threads/sengkang-grc-residents-are-you-ready-for-a-by-election.6633331/,sengkang,"Nov 1, 2021"
Eat-Drink-Man-Woman,SengKang or Punggol,https://forums.hardwarezone.com.sg/threads/sengkang-or-punggol.6616249/,sengkang,"Oct 8, 2021"
Current Affairs Lounge,[ST] How WP won over Sengkang,https://forums.hardwarezone.com.sg/threads/st-how-wp-won-over-sengkang.6334697/,sengkang,"Jul 12, 2020"
Eat-Drink-Man-Woman,Smallest pasar malam in sengkang,https://forums.hardwarezone.com.sg/threads/smallest-pasar-malam-in-sengkang.6769401/,sengkang,"Jun 23, 2022"
Eat-Drink-Man-Woman,16 tenants slam Sengkang HDB flat landlord for confiscating deposits after making them move out,https://forums.hardwarezone.com.sg/threads/16-tenants-slam-sengkang-hdb-flat-landlord-for-confiscating-deposits-after-making-them-move-out.6717462/,sengkang,"Mar 18, 2022"
Eat-Drink-Man-Woman,Why you choose to live in punggol/sengkang?,https://forums.hardwarezone.com.sg/threads/why-you-choose-to-live-in-punggol-sengkang.6746220/page-6,sengkang,"May 9, 2022"
Eat-Drink-Man-Woman,27yo jumped/fell from sengkang flat?,https://forums.hardwarezone.com.sg/threads/27yo-jumped-fell-from-sengkang-flat.6493444/,sengkang,"Apr 6, 2021"
Eat-Drink-Man-Woman,"Sengkang resident fills lift landing, corridor with items last 3 years, neighbour moves out to avoid dispute",https://forums.hardwarezone.com.sg/threads/sengkang-resident-fills-lift-landing-corridor-with-items-last-3-years-neighbour-moves-out-to-avoid-dispute.6659104/,sengkang,"Dec 13, 2021"
Eat-Drink-Man-Woman,Song Boh!!!!!! Compensation for buyers of Sengkang BTO flats over delay of 4~6 months in completion date,https://forums.hardwarezone.com.sg/threads/song-boh-compensation-for-buyers-of-sengkang-bto-flats-over-delay-of-4-6-months-in-completion-date.6753557/,sengkang,"May 23, 2022"
Eat-Drink-Man-Woman,25yo woman found dead at foot of sengkang block,https://forums.hardwarezone.com.sg/threads/25yo-woman-found-dead-at-foot-of-sengkang-block.6542970/,sengkang,"Jun 24, 2021"
Football and Sports Arena,Soccer at Sengkang cage,https://forums.hardwarezone.com.sg/threads/soccer-at-sengkang-cage.5382302/,sengkang,"May 30, 2016"
Eat-Drink-Man-Woman,Sengkang residents complain WP lousier than PAP. They regret liao!!,https://forums.hardwarezone.com.sg/threads/sengkang-residents-complain-wp-lousier-than-pap-they-regret-liao.6529813/,sengkang,"Jun 3, 2021"
Eat-Drink-Man-Woman,News| PAP treads Sengkang ground with caution in the wake of WP-Raeesah fallout,https://forums.hardwarezone.com.sg/threads/news-pap-treads-sengkang-ground-with-caution-in-the-wake-of-wp-raeesah-fallout.6706260/,sengkang,"Feb 28, 2022"
Eat-Drink-Man-Woman,"Sengkang resident with cancer blasts 9 air-cons at once for comfort, condensation forms in upper unit",https://forums.hardwarezone.com.sg/threads/sengkang-resident-with-cancer-blasts-9-air-cons-at-once-for-comfort-condensation-forms-in-upper-unit.6798261/,sengkang,"Aug 22, 2022"
Eat-Drink-Man-Woman,Sengkang condo incident: Man sentenced to 10 years in prison for culpable homicide of his wife,https://forums.hardwarezone.com.sg/threads/sengkang-condo-incident-man-sentenced-to-10-years-in-prison-for-culpable-homicide-of-his-wife.6523183/page-2,sengkang,"May 24, 2021"
Eat-Drink-Man-Woman,Sengkang 5 room flat nowadays can fetch over 800k,https://forums.hardwarezone.com.sg/threads/sengkang-5-room-flat-nowadays-can-fetch-over-800k.6483623/page-4,sengkang,"Mar 17, 2021"
HomeSeekers and HomeMakers,Sengkang residences,https://forums.hardwarezone.com.sg/threads/sengkang-residences.6132603/page-37,sengkang,"Oct 19, 2019"
Eat-Drink-Man-Woman,Sengkang residents complain WP lousier than PAP. They regret liao!!,https://forums.hardwarezone.com.sg/threads/sengkang-residents-complain-wp-lousier-than-pap-they-regret-liao.6529813/page-13,sengkang,"Jun 3, 2021"
HomeSeekers and HomeMakers,Sengkang residences,https://forums.hardwarezone.com.sg/threads/sengkang-residences.6132603/page-16,sengkang,"Oct 19, 2019"
Eat-Drink-Man-Woman,Sengkang General Hospital operating theatre nurse C19 +ve,https://forums.hardwarezone.com.sg/threads/sengkang-general-hospital-operating-theatre-nurse-c19-ve.6513966/page-3,sengkang,"May 12, 2021"
Eat-Drink-Man-Woman,Power Outage in Ponggol Sengkang?,https://forums.hardwarezone.com.sg/threads/power-outage-in-ponggol-sengkang.6655359/,sengkang,"Dec 7, 2021"
Eat-Drink-Man-Woman,'My neighbours ganged up against me': Man with 9 air-con units moves out of Sengkang flat,https://forums.hardwarezone.com.sg/threads/my-neighbours-ganged-up-against-me-man-with-9-air-con-units-moves-out-of-sengkang-flat.6812337/,sengkang,"Sep 21, 2022"
Eat-Drink-Man-Woman,Why you choose to live in punggol/sengkang?,https://forums.hardwarezone.com.sg/threads/why-you-choose-to-live-in-punggol-sengkang.6746220/page-5,sengkang,"May 9, 2022"
HomeSeekers and HomeMakers,Sengkang central residences,https://forums.hardwarezone.com.sg/threads/sengkang-central-residences.6060030/page-23,sengkang,"Jun 10, 2019"
Eat-Drink-Man-Woman,Omg got a cute and petite zeh zeh selling rojak at sengkang kopitiam Square!,https://forums.hardwarezone.com.sg/threads/omg-got-a-cute-and-petite-zeh-zeh-selling-rojak-at-sengkang-kopitiam-square.6697111/,sengkang,"Feb 14, 2022"
Eat-Drink-Man-Woman,Sengkang 1 person tio toto Group 1 $5 million,https://forums.hardwarezone.com.sg/threads/sengkang-1-person-tio-toto-group-1-5-million.6790553/,sengkang,"Aug 5, 2022"
Eat-Drink-Man-Woman,Why you choose to live in punggol/sengkang?,https://forums.hardwarezone.com.sg/threads/why-you-choose-to-live-in-punggol-sengkang.6746220/page-3,sengkang,"May 9, 2022"
Eat-Drink-Man-Woman,GPGT: Sengkang residents seemed unwilling to pose for a photo with potential PAP's GE2025 Candidate,https://forums.hardwarezone.com.sg/threads/gpgt-sengkang-residents-seemed-unwilling-to-pose-for-a-photo-with-potential-paps-ge2025-candidate.6771645/,sengkang,"Jun 28, 2022"
Eat-Drink-Man-Woman,"6,500 drivers caught speeding on five roads in Sengkang in 18 months",https://forums.hardwarezone.com.sg/threads/6-500-drivers-caught-speeding-on-five-roads-in-sengkang-in-18-months.6494005/,sengkang,"Apr 7, 2021"
Current Affairs Lounge,[ST] How WP won over Sengkang,https://forums.hardwarezone.com.sg/threads/st-how-wp-won-over-sengkang.6334697/page-12,sengkang,"Jul 12, 2020"
HomeSeekers and HomeMakers,Pasir Ris 8 Vs SengKang Grand Residences,https://forums.hardwarezone.com.sg/threads/pasir-ris-8-vs-sengkang-grand-residences.6568965/page-2,sengkang,"Aug 1, 2021"
HomeSeekers and HomeMakers,Sengkang Central Residences,https://forums.hardwarezone.com.sg/threads/sengkang-central-residences.6079365/page-11,sengkang,"Jul 16, 2019"
HomeSeekers and HomeMakers,Sengkang Central Residences,https://forums.hardwarezone.com.sg/threads/sengkang-central-residences.6079365/page-5,sengkang,"Jul 16, 2019"
Eat-Drink-Man-Woman,Blue tent at blk 178C/D Sengkang,https://forums.hardwarezone.com.sg/threads/blue-tent-at-blk-178c-d-sengkang.6622987/,sengkang,"Oct 16, 2021"
Eat-Drink-Man-Woman,....jialat....Hawkers kpkb newly opened sengkang new food centre keep having power failure.....like that how to do business....,https://forums.hardwarezone.com.sg/threads/jialat-hawkers-kpkb-newly-opened-sengkang-new-food-centre-keep-having-power-failure-like-that-how-to-do-business.6785288/page-5,sengkang,"Jul 26, 2022"
Eat-Drink-Man-Woman,[BREAKING] SENGKANG IS OFFICIALLY SLUM LAND,https://forums.hardwarezone.com.sg/threads/breaking-sengkang-is-officially-slum-land.6617516/page-2,sengkang,"Oct 9, 2021"
Eat-Drink-Man-Woman,BREAKING: No by-election in Sengkang GRC after Raeesah Khan's resignation: WP,https://forums.hardwarezone.com.sg/threads/breaking-no-by-election-in-sengkang-grc-after-raeesah-khans-resignation-wp.6652222/,sengkang,"Dec 2, 2021"
HomeSeekers and HomeMakers,Sengkang columbarium falls through,https://forums.hardwarezone.com.sg/threads/sengkang-columbarium-falls-through.5046642/,sengkang,"May 9, 2015"
Health & Fitness Corner,any new gym in punggol/sengkang/hougang?,https://forums.hardwarezone.com.sg/threads/any-new-gym-in-punggol-sengkang-hougang.5135144/,sengkang,"Aug 13, 2015"
Eat-Drink-Man-Woman,"SIC nice food in punggol, sengkang hougang area",https://forums.hardwarezone.com.sg/threads/sic-nice-food-in-punggol-sengkang-hougang-area.6383836/,sengkang,"Sep 29, 2020"
Eat-Drink-Man-Woman,"""Longer runway"" needed for PAP's three new faces in Sengkang to connect with residents",https://forums.hardwarezone.com.sg/threads/longer-runway-needed-for-paps-three-new-faces-in-sengkang-to-connect-with-residents.6723521/,sengkang,"Mar 28, 2022"
Eat-Drink-Man-Woman,"Sengkang Block 295B suspected to be haunted, residents going crazy with mysterious loud bangings",https://forums.hardwarezone.com.sg/threads/sengkang-block-295b-suspected-to-be-haunted-residents-going-crazy-with-mysterious-loud-bangings.6552321/page-2,sengkang,"Jul 9, 2021"
Current Affairs Lounge,[Breaking] Sengkang GRC is The Workers Party’s 🔨,https://forums.hardwarezone.com.sg/threads/breaking-sengkang-grc-is-the-workers-partys.6332994/,sengkang,"Jul 11, 2020"
Eat-Drink-Man-Woman,"永和豆浆油条大王 Yong He Eating House opening in Toa Payoh, Sengkang & Jurong West!!!",https://forums.hardwarezone.com.sg/threads/yong-he-eating-house-opening-in-toa-payoh-sengkang-jurong-west.6629456/,sengkang,"Oct 26, 2021"
Eat-Drink-Man-Woman,Man resists arrest after accident involving stolen car and truck in Sengkang,https://forums.hardwarezone.com.sg/threads/man-resists-arrest-after-accident-involving-stolen-car-and-truck-in-sengkang.6761692/,sengkang,"Jun 8, 2022"
Eat-Drink-Man-Woman,Hospital Besar Sengkang,https://forums.hardwarezone.com.sg/threads/hospital-besar-sengkang.6462910/,sengkang,"Feb 9, 2021"
Eat-Drink-Man-Woman,[BREAKING] SENGKANG IS OFFICIALLY SLUM LAND,https://forums.hardwarezone.com.sg/threads/breaking-sengkang-is-officially-slum-land.6617516/,sengkang,"Oct 9, 2021"
HomeSeekers and HomeMakers,Sengkang Central Residences,https://forums.hardwarezone.com.sg/threads/sengkang-central-residences.6079365/page-7,sengkang,"Jul 16, 2019"
Eat-Drink-Man-Woman,From Sengkang to Town damm troublesome,https://forums.hardwarezone.com.sg/threads/from-sengkang-to-town-damm-troublesome.6620202/page-3,sengkang,"Oct 12, 2021"
Eat-Drink-Man-Woman,"3 new Covid-19 clusters in S'pore, including Sengkang & Bishan bus interchanges",https://forums.hardwarezone.com.sg/threads/3-new-covid-19-clusters-in-spore-including-sengkang-bishan-bus-interchanges.6578595/,sengkang,"Aug 14, 2021"
