Eat-Drink-Man-Woman,How many hours do you shop at Jurong East: JEM WestGate JCube and IMM? 🏪🏪🏪,https://forums.hardwarezone.com.sg/threads/how-many-hours-do-you-shop-at-jurong-east-jem-westgate-jcube-and-imm.6609400/page-2,jurong east,"Sep 28, 2021"
Eat-Drink-Man-Woman,"Grace Fu visited Jurong East fire site this morning to express condolences, both town council & HDB are providing assistance to affected residents.",https://forums.hardwarezone.com.sg/threads/grace-fu-visited-jurong-east-fire-site-this-morning-to-express-condolences-both-town-council-hdb-are-providing-assistance-to-affected-residents.6795310/page-3,jurong east,"Aug 16, 2022"
Internet Bandwidth & Networking Clinic,Singtel reception sucks,https://forums.hardwarezone.com.sg/threads/singtel-reception-sucks.3688907/,jurong east,"Apr 16, 2012"
HomeSeekers and HomeMakers,HDB 4A for rent (Jurong East),https://forums.hardwarezone.com.sg/threads/hdb-4a-for-rent-jurong-east.4526417/,jurong east,"Jan 3, 2014"
Eat-Drink-Man-Woman,[GPGT] Jurong East sky now........... I shudder,https://forums.hardwarezone.com.sg/threads/gpgt-jurong-east-sky-now-i-shudder.6813589/page-2,jurong east,"Sep 24, 2022"
Eat-Drink-Man-Woman,"[GPGT] Jurong east/Teban garden residents huat liao, 4 mrt station nearby each other",https://forums.hardwarezone.com.sg/threads/gpgt-jurong-east-teban-garden-residents-huat-liao-4-mrt-station-nearby-each-other.6811976/page-2,jurong east,"Sep 20, 2022"
Eat-Drink-Man-Woman,Tiagong confirmed case in one primary school at Jurong east dio liao,https://forums.hardwarezone.com.sg/threads/tiagong-confirmed-case-in-one-primary-school-at-jurong-east-dio-liao.6518664/,jurong east,"May 18, 2021"
Eat-Drink-Man-Woman,"[GPGT] Jurong east/Teban garden residents huat liao, 4 mrt station nearby each other",https://forums.hardwarezone.com.sg/threads/gpgt-jurong-east-teban-garden-residents-huat-liao-4-mrt-station-nearby-each-other.6811976/page-4,jurong east,"Sep 20, 2022"
Eat-Drink-Man-Woman,[GLGT] Jurong East bus interchange to be relocated from Dec 6 till 2027,https://forums.hardwarezone.com.sg/threads/glgt-jurong-east-bus-interchange-to-be-relocated-from-dec-6-till-2027.6408722/page-5,jurong east,"Nov 11, 2020"
Eat-Drink-Man-Woman,"Near jurong East MRT, whixh gym is the most wuhua??",https://forums.hardwarezone.com.sg/threads/near-jurong-east-mrt-whixh-gym-is-the-most-wuhua.6652108/page-2,jurong east,"Dec 2, 2021"
Eat-Drink-Man-Woman,[GLGT] Jurong East bus interchange to be relocated from Dec 6 till 2027,https://forums.hardwarezone.com.sg/threads/glgt-jurong-east-bus-interchange-to-be-relocated-from-dec-6-till-2027.6408722/page-7,jurong east,"Nov 11, 2020"
Eat-Drink-Man-Woman,Help me to choose! Buy at Jurong West Street 91 or Marsling Lane?,https://forums.hardwarezone.com.sg/threads/help-me-to-choose-buy-at-jurong-west-street-91-or-marsling-lane.6428633/page-5,jurong west,"Dec 14, 2020"
Eat-Drink-Man-Woman,"Jurong West landlord wants S$10 more for tenant to charge laptop, imposes list of don'ts for renting S$750 room",https://forums.hardwarezone.com.sg/threads/jurong-west-landlord-wants-s-10-more-for-tenant-to-charge-laptop-imposes-list-of-donts-for-renting-s-750-room.6757827/,jurong west,"May 31, 2022"
Eat-Drink-Man-Woman,[GLGT] Eh Jurong West Blk 840 really got ghost ah?,https://forums.hardwarezone.com.sg/threads/glgt-eh-jurong-west-blk-840-really-got-ghost-ah.6560734/page-2,jurong west,"Jul 20, 2021"
Eat-Drink-Man-Woman,[GLGT] Eh Jurong West Blk 840 really got ghost ah?,https://forums.hardwarezone.com.sg/threads/glgt-eh-jurong-west-blk-840-really-got-ghost-ah.6560734/,jurong west,"Jul 20, 2021"
Eat-Drink-Man-Woman,Kanye West lookalike spotted riding bicycle in Jurong West,https://forums.hardwarezone.com.sg/threads/kanye-west-lookalike-spotted-riding-bicycle-in-jurong-west.6598054/,jurong west,"Sep 13, 2021"
Eat-Drink-Man-Woman,Yishun is more livable than Jurong West Pioneer,https://forums.hardwarezone.com.sg/threads/yishun-is-more-livable-than-jurong-west-pioneer.6447458/,jurong west,"Jan 14, 2021"
Eat-Drink-Man-Woman,PMD fire @ Jurong West,https://forums.hardwarezone.com.sg/threads/pmd-fire-jurong-west.6616298/,jurong west,"Oct 8, 2021"
Eat-Drink-Man-Woman,Mandatory COVID-19 testing for all residents of 695 Jurong West Central 1 (So far 14 cases detected in 6 households),https://forums.hardwarezone.com.sg/threads/mandatory-covid-19-testing-for-all-residents-of-695-jurong-west-central-1-so-far-14-cases-detected-in-6-households.6579840/,jurong west,"Aug 16, 2021"
Eat-Drink-Man-Woman,Sai Smell In Jurong West,https://forums.hardwarezone.com.sg/threads/sai-smell-in-jurong-west.6619487/,jurong west,"Oct 11, 2021"
Eat-Drink-Man-Woman,Jurong west Ave 3...jumped from 14th flr,https://forums.hardwarezone.com.sg/threads/jurong-west-ave-3-jumped-from-14th-flr.6597785/,jurong west,"Sep 13, 2021"
Eat-Drink-Man-Woman,Another Grand Funeral in Jurong West,https://forums.hardwarezone.com.sg/threads/another-grand-funeral-in-jurong-west.6591489/,jurong west,"Sep 4, 2021"
Eat-Drink-Man-Woman,Jurong West got what thing to eat?,https://forums.hardwarezone.com.sg/threads/jurong-west-got-what-thing-to-eat.6699605/page-2,jurong west,"Feb 18, 2022"
Eat-Drink-Man-Woman,Jurong West upcoming prime matured estate? BTO 14.2 times oversubscribed,https://forums.hardwarezone.com.sg/threads/jurong-west-upcoming-prime-matured-estate-bto-14-2-times-oversubscribed.6758894/,jurong west,"Jun 2, 2022"
HomeSeekers and HomeMakers,Advice Needed! ! ! BTO Tengah or BTO Boon Lay Glade / Jurong West Jewel ??,https://forums.hardwarezone.com.sg/threads/advice-needed-bto-tengah-or-bto-boon-lay-glade-jurong-west-jewel.6027998/,jurong west,"Apr 16, 2019"
Eat-Drink-Man-Woman,Those staying Jurong west jin cham hor?,https://forums.hardwarezone.com.sg/threads/those-staying-jurong-west-jin-cham-hor.6694882/,jurong west,"Feb 10, 2022"
Eat-Drink-Man-Woman,"Fireworks at Jurong West, Woodlands & Bedok stadiums, former TJC & field in front of AMK library ard 8.15pm, same time as display at main NDP parade",https://forums.hardwarezone.com.sg/threads/fireworks-at-jurong-west-woodlands-bedok-stadiums-former-tjc-field-in-front-of-amk-library-ard-8-15pm-same-time-as-display-at-main-ndp-parade.6778678/,jurong west,"Jul 13, 2022"
Eat-Drink-Man-Woman,PMD fire @ Jurong West,https://forums.hardwarezone.com.sg/threads/pmd-fire-jurong-west.6616298/page-3,jurong west,"Oct 8, 2021"
Eat-Drink-Man-Woman,26 Y.O MAN FOUND MOTIONLESS AT FOOT OF JURONG WEST HDB,https://forums.hardwarezone.com.sg/threads/26-y-o-man-found-motionless-at-foot-of-jurong-west-hdb.6597913/,jurong west,"Sep 13, 2021"
Eat-Drink-Man-Woman,(WTF) Haunted house in Jurong Street 81?!,https://forums.hardwarezone.com.sg/threads/wtf-haunted-house-in-jurong-street-81.6561963/,jurong west,"Jul 22, 2021"
Eat-Drink-Man-Woman,Jurong West resident warns ppl getting Tengah BTO. He gvgt jet flying,https://forums.hardwarezone.com.sg/threads/jurong-west-resident-warns-ppl-getting-tengah-bto-he-gvgt-jet-flying.6421440/page-4,jurong west,"Dec 2, 2020"
Eat-Drink-Man-Woman,71-year-old woman stands on window ledge at Jurong West HDB block,https://forums.hardwarezone.com.sg/threads/71-year-old-woman-stands-on-window-ledge-at-jurong-west-hdb-block.6726978/page-2,jurong west,"Apr 4, 2022"
Eat-Drink-Man-Woman,Someone dead at Jurong west,https://forums.hardwarezone.com.sg/threads/someone-dead-at-jurong-west.6597698/,jurong west,"Sep 13, 2021"
Eat-Drink-Man-Woman,GPGT - 'Unexpected dirty' tap water at Jurong West,https://forums.hardwarezone.com.sg/threads/gpgt-unexpected-dirty-tap-water-at-jurong-west.6631019/,jurong west,"Oct 28, 2021"
Eat-Drink-Man-Woman,22yo resident pronounced dead at scene of Jurong West HDB fire linked to PMD,https://forums.hardwarezone.com.sg/threads/22yo-resident-pronounced-dead-at-scene-of-jurong-west-hdb-fire-linked-to-pmd.6616329/page-2,jurong west,"Oct 8, 2021"
Eat-Drink-Man-Woman,"Man who witnessed Jurong West slashing lied to police to protect assailant, jailed for 17 months, five weeks and fined $4,000",https://forums.hardwarezone.com.sg/threads/man-who-witnessed-jurong-west-slashing-lied-to-police-to-protect-assailant-jailed-for-17-months-five-weeks-and-fined-4-000.6675166/,jurong west,"Jan 8, 2022"
Eat-Drink-Man-Woman,Jurong West upcoming prime matured estate? BTO 14.2 times oversubscribed,https://forums.hardwarezone.com.sg/threads/jurong-west-upcoming-prime-matured-estate-bto-14-2-times-oversubscribed.6758894/page-2,jurong west,"Jun 2, 2022"
Eat-Drink-Man-Woman,[GVGT] Another fire. Jurong West 738,https://forums.hardwarezone.com.sg/threads/gvgt-another-fire-jurong-west-738.6474238/,jurong west,"Feb 28, 2021"
Eat-Drink-Man-Woman,[GVGT] killer manhole cover at Jurong West Ave 2,https://forums.hardwarezone.com.sg/threads/gvgt-killer-manhole-cover-at-jurong-west-ave-2.6754129/,jurong west,"May 24, 2022"
Eat-Drink-Man-Woman,"[WLWLSMDWL] 10 new Covid-19 clusters in S'pore, including Jurong West GP clinic",https://forums.hardwarezone.com.sg/threads/wlwlsmdwl-10-new-covid-19-clusters-in-spore-including-jurong-west-gp-clinic.6565049/,jurong west,"Jul 27, 2021"
Eat-Drink-Man-Woman,FUNERAL AT JURONG WEST WITH OVER 200 PEOPLE,https://forums.hardwarezone.com.sg/threads/funeral-at-jurong-west-with-over-200-people.6591475/,jurong west,"Sep 4, 2021"
Eat-Drink-Man-Woman,Help me to choose! Buy at Jurong West Street 91 or Marsling Lane?,https://forums.hardwarezone.com.sg/threads/help-me-to-choose-buy-at-jurong-west-street-91-or-marsling-lane.6428633/page-3,jurong west,"Dec 14, 2020"
Eat-Drink-Man-Woman,[GPGT] Crowded at Jurong West 505 Market & Food Centre,https://forums.hardwarezone.com.sg/threads/gpgt-crowded-at-jurong-west-505-market-food-centre.6662781/page-3,jurong west,"Dec 19, 2021"
Eat-Drink-Man-Woman,"660A Jurong West St 64 level 10, 11 and 12 residents many disputes over sound disturbances from unknown source for past 4 years unresolved",https://forums.hardwarezone.com.sg/threads/660a-jurong-west-st-64-level-10-11-and-12-residents-many-disputes-over-sound-disturbances-from-unknown-source-for-past-4-years-unresolved.6578695/,jurong west,"Aug 15, 2021"
Eat-Drink-Man-Woman,[GVGT] Jurong West HDB why so mouldy?,https://forums.hardwarezone.com.sg/threads/gvgt-jurong-west-hdb-why-so-mouldy.6687119/,jurong west,"Jan 29, 2022"
Eat-Drink-Man-Woman,Jurong West Coffee shop sold for record 31 million,https://forums.hardwarezone.com.sg/threads/jurong-west-coffee-shop-sold-for-record-31-million.6752840/page-4,jurong west,"May 21, 2022"
Eat-Drink-Man-Woman,Jurong West St 81 haunted HDB flat story is actually about Jurong West St 42 HDB maisonette,https://forums.hardwarezone.com.sg/threads/jurong-west-st-81-haunted-hdb-flat-story-is-actually-about-jurong-west-st-42-hdb-maisonette.6562352/,jurong west,"Jul 23, 2021"
Eat-Drink-Man-Woman,Have you noticed a 10/10 hawker at 505 Jurong West hawker centre?,https://forums.hardwarezone.com.sg/threads/have-you-noticed-a-10-10-hawker-at-505-jurong-west-hawker-centre.6580576/page-2,jurong west,"Aug 17, 2021"
Eat-Drink-Man-Woman,Near Jurong point HDB asking 900k?,https://forums.hardwarezone.com.sg/threads/near-jurong-point-hdb-asking-900k.6481847/,jurong west,"Mar 14, 2021"
Eat-Drink-Man-Woman,Those staying Jurong west jin cham hor?,https://forums.hardwarezone.com.sg/threads/those-staying-jurong-west-jin-cham-hor.6694882/page-5,jurong west,"Feb 10, 2022"
Eat-Drink-Man-Woman,[GPGT] Crowded at Jurong West 505 Market & Food Centre,https://forums.hardwarezone.com.sg/threads/gpgt-crowded-at-jurong-west-505-market-food-centre.6662781/page-6,jurong west,"Dec 19, 2021"
Eat-Drink-Man-Woman,5 taken to hospital after PAB sparks fire in Jurong West flat,https://forums.hardwarezone.com.sg/threads/5-taken-to-hospital-after-pab-sparks-fire-in-jurong-west-flat.6681669/,jurong west,"Jan 19, 2022"
Eat-Drink-Man-Woman,Jurong West HDB fire linked to PMD 1 person dead,https://forums.hardwarezone.com.sg/threads/jurong-west-hdb-fire-linked-to-pmd-1-person-dead.6616365/,jurong west,"Oct 8, 2021"
Eat-Drink-Man-Woman,Jurong West resident warns ppl getting Tengah BTO. He gvgt jet flying,https://forums.hardwarezone.com.sg/threads/jurong-west-resident-warns-ppl-getting-tengah-bto-he-gvgt-jet-flying.6421440/page-12,jurong west,"Dec 2, 2020"
Eat-Drink-Man-Woman,Van catches fire at Jurong West,https://forums.hardwarezone.com.sg/threads/van-catches-fire-at-jurong-west.6751678/,jurong west,"May 19, 2022"
HomeSeekers and HomeMakers,May 2013 BTO - Jurong West (Spring Haven),https://forums.hardwarezone.com.sg/threads/may-2013-bto-jurong-west-spring-haven.4283972/page-6,jurong west,"Jul 4, 2013"
HomeSeekers and HomeMakers,Jurong west no more plot for condo development liao?,https://forums.hardwarezone.com.sg/threads/jurong-west-no-more-plot-for-condo-development-liao.6370302/,jurong west,"Sep 6, 2020"
Eat-Drink-Man-Woman,Jurong West Coffee shop sold for record 31 million,https://forums.hardwarezone.com.sg/threads/jurong-west-coffee-shop-sold-for-record-31-million.6752840/page-2,jurong west,"May 21, 2022"
Eat-Drink-Man-Woman,GVGT: Jurong West cyclist fails to conform to red light and get knocked down,https://forums.hardwarezone.com.sg/threads/gvgt-jurong-west-cyclist-fails-to-conform-to-red-light-and-get-knocked-down.6628611/,jurong west,"Oct 25, 2021"
Internet Bandwidth & Networking Clinic,Fibre cut at Jurong West,https://forums.hardwarezone.com.sg/threads/fibre-cut-at-jurong-west.5599314/,jurong west,"Apr 11, 2017"
Eat-Drink-Man-Woman,"[DURIAN SALE] Jurong West market selling many ""affordable"" lewlian, simi pricing all hab right down to $1 ones .. Pre-pack 3 for $10 many yellow2 ..",https://forums.hardwarezone.com.sg/threads/durian-sale-jurong-west-market-selling-many-affordable-lewlian-simi-pricing-all-hab-right-down-to-1-ones-pre-pack-3-for-10-many-yellow2.6776568/,jurong west,"Jul 9, 2022"
Eat-Drink-Man-Woman,"Jurong West landlord wants S$10 more for tenant to charge laptop, imposes list of don'ts for renting S$750 room",https://forums.hardwarezone.com.sg/threads/jurong-west-landlord-wants-s-10-more-for-tenant-to-charge-laptop-imposes-list-of-donts-for-renting-s-750-room.6757827/page-5,jurong west,"May 31, 2022"
Eat-Drink-Man-Woman,Those staying Jurong west jin cham hor?,https://forums.hardwarezone.com.sg/threads/those-staying-jurong-west-jin-cham-hor.6694882/page-3,jurong west,"Feb 10, 2022"
Eat-Drink-Man-Woman,Sai Smell In Jurong West,https://forums.hardwarezone.com.sg/threads/sai-smell-in-jurong-west.6619487/page-2,jurong west,"Oct 11, 2021"
Eat-Drink-Man-Woman,Police called in on 29 people gathering for prayers at Slumrong West flat,https://forums.hardwarezone.com.sg/threads/police-called-in-on-29-people-gathering-for-prayers-at-slumrong-west-flat.6631595/,jurong west,"Oct 29, 2021"
Eat-Drink-Man-Woman,Jurong West resident warns ppl getting Tengah BTO. He gvgt jet flying,https://forums.hardwarezone.com.sg/threads/jurong-west-resident-warns-ppl-getting-tengah-bto-he-gvgt-jet-flying.6421440/,jurong west,"Dec 2, 2020"
Eat-Drink-Man-Woman,Jurong West got what thing to eat?,https://forums.hardwarezone.com.sg/threads/jurong-west-got-what-thing-to-eat.6699605/,jurong west,"Feb 18, 2022"
Eat-Drink-Man-Woman,Man who witnessed Jurong West slashing lied to police to protect assailant,https://forums.hardwarezone.com.sg/threads/man-who-witnessed-jurong-west-slashing-lied-to-police-to-protect-assailant.6675103/,jurong west,"Jan 8, 2022"
Eat-Drink-Man-Woman,Polytechnic student gets jail for causing e-bike rider's death in crash at Jurong West car park,https://forums.hardwarezone.com.sg/threads/polytechnic-student-gets-jail-for-causing-e-bike-riders-death-in-crash-at-jurong-west-car-park.6758236/,jurong west,"Jun 1, 2022"
HomeSeekers and HomeMakers,May 2013 BTO - Jurong West (Spring Haven),https://forums.hardwarezone.com.sg/threads/may-2013-bto-jurong-west-spring-haven.4283972/,jurong west,"Jul 4, 2013"
Eat-Drink-Man-Woman,Jurong West resident warns ppl getting Tengah BTO. He gvgt jet flying,https://forums.hardwarezone.com.sg/threads/jurong-west-resident-warns-ppl-getting-tengah-bto-he-gvgt-jet-flying.6421440/page-2,jurong west,"Dec 2, 2020"
Eat-Drink-Man-Woman,A community cat in Jurong West was seen constricted to death by a python.,https://forums.hardwarezone.com.sg/threads/a-community-cat-in-jurong-west-was-seen-constricted-to-death-by-a-python.6799022/,jurong west,"Aug 24, 2022"
Eat-Drink-Man-Woman,......$12 caipng from jurong west........fish alone is $8.....kym,https://forums.hardwarezone.com.sg/threads/12-caipng-from-jurong-west-fish-alone-is-8-kym.6807997/,jurong west,"Sep 11, 2022"
Eat-Drink-Man-Woman,"If let you choose, would u rather stay at Tenpenis, Jurong west or CCK?",https://forums.hardwarezone.com.sg/threads/if-let-you-choose-would-u-rather-stay-at-tenpenis-jurong-west-or-cck.6732457/page-2,jurong west,"Apr 15, 2022"
Eat-Drink-Man-Woman,Do you find Jurong West over populated?,https://forums.hardwarezone.com.sg/threads/do-you-find-jurong-west-over-populated.6732212/,jurong west,"Apr 14, 2022"
Eat-Drink-Man-Woman,Those staying Jurong west jin cham hor?,https://forums.hardwarezone.com.sg/threads/those-staying-jurong-west-jin-cham-hor.6694882/page-2,jurong west,"Feb 10, 2022"
Eat-Drink-Man-Woman,"Jurong West stall charges $12 for cai fan, says leathery piece of 'fresh fish' is $8",https://forums.hardwarezone.com.sg/threads/jurong-west-stall-charges-12-for-cai-fan-says-leathery-piece-of-fresh-fish-is-8.6808411/,jurong west,"Sep 12, 2022"
Eat-Drink-Man-Woman,......$12 caipng from jurong west........fish alone is $8.....kym,https://forums.hardwarezone.com.sg/threads/12-caipng-from-jurong-west-fish-alone-is-8-kym.6807997/page-3,jurong west,"Sep 11, 2022"
Eat-Drink-Man-Woman,[GPGT] Crowded at Jurong West 505 Market & Food Centre,https://forums.hardwarezone.com.sg/threads/gpgt-crowded-at-jurong-west-505-market-food-centre.6662781/page-7,jurong west,"Dec 19, 2021"
Eat-Drink-Man-Woman,Help me to choose! Buy at Jurong West Street 91 or Marsling Lane?,https://forums.hardwarezone.com.sg/threads/help-me-to-choose-buy-at-jurong-west-street-91-or-marsling-lane.6428633/page-4,jurong west,"Dec 14, 2020"
Eat-Drink-Man-Woman,"Jurong West landlord wants S$10 more for tenant to charge laptop, imposes list of don'ts for renting S$750 room",https://forums.hardwarezone.com.sg/threads/jurong-west-landlord-wants-s-10-more-for-tenant-to-charge-laptop-imposes-list-of-donts-for-renting-s-750-room.6757827/page-3,jurong west,"May 31, 2022"
Eat-Drink-Man-Woman,Jurong West coffee shop after sold despite rental fine-tuned but most vendors did not increase prices to reward customers,https://forums.hardwarezone.com.sg/threads/jurong-west-coffee-shop-after-sold-despite-rental-fine-tuned-but-most-vendors-did-not-increase-prices-to-reward-customers.6775295/page-2,jurong west,"Jul 6, 2022"
Eat-Drink-Man-Woman,....$6.5 nasi lemak from jurong west....expensive anot??????,https://forums.hardwarezone.com.sg/threads/6-5-nasi-lemak-from-jurong-west-expensive-anot.6796583/,jurong west,"Aug 19, 2022"
Eat-Drink-Man-Woman,Jurong West go groom to look like Kanye West,https://forums.hardwarezone.com.sg/threads/jurong-west-go-groom-to-look-like-kanye-west.6600443/,jurong west,"Sep 16, 2021"
Eat-Drink-Man-Woman,Masterchef finalist to open 5th Ban Mian outlet in jurong west....but some cannot make it,https://forums.hardwarezone.com.sg/threads/masterchef-finalist-to-open-5th-ban-mian-outlet-in-jurong-west-but-some-cannot-make-it.6648762/,jurong west,"Nov 27, 2021"
Pets Inner Circle,"Help! Have You Seen MIMI, a Missing Cockatiel, Lost at Jurong West?",https://forums.hardwarezone.com.sg/threads/help-have-you-seen-mimi-a-missing-cockatiel-lost-at-jurong-west.6620723/,jurong west,"Oct 13, 2021"
Eat-Drink-Man-Woman,22yo resident pronounced dead at scene of Jurong West HDB fire linked to PMD,https://forums.hardwarezone.com.sg/threads/22yo-resident-pronounced-dead-at-scene-of-jurong-west-hdb-fire-linked-to-pmd.6616329/,jurong west,"Oct 8, 2021"
Eat-Drink-Man-Woman,Jurong West Lobang,https://forums.hardwarezone.com.sg/threads/jurong-west-lobang.6652555/,jurong west,"Dec 2, 2021"
Eat-Drink-Man-Woman,"MP: ""Jurong West Blk 505 Market fishmongers are tested Negative... Having the busiest market in S'pore means we need to do better for our resident""",https://forums.hardwarezone.com.sg/threads/mp-jurong-west-blk-505-market-fishmongers-are-tested-negative-having-the-busiest-market-in-spore-means-we-need-to-do-better-for-our-resident.6558442/page-4,jurong west,"Jul 18, 2021"
Cars & Cars,Coin-operated water supply taps @ Jurong West,https://forums.hardwarezone.com.sg/threads/coin-operated-water-supply-taps-jurong-west.6147778/,jurong west,"Nov 13, 2019"
Eat-Drink-Man-Woman,"Jurong West coffee shop sells for 8-figure sum, stallholders not increasing prices despite rent adjustment",https://forums.hardwarezone.com.sg/threads/jurong-west-coffee-shop-sells-for-8-figure-sum-stallholders-not-increasing-prices-despite-rent-adjustment.6776106/,jurong west,"Jul 8, 2022"
Eat-Drink-Man-Woman,40 evacuated after fire involving items at common area of Jurong West block 534,https://forums.hardwarezone.com.sg/threads/40-evacuated-after-fire-involving-items-at-common-area-of-jurong-west-block-534.6674075/,jurong west,"Jan 6, 2022"
Eat-Drink-Man-Woman,SIC : nice food west Singapore,https://forums.hardwarezone.com.sg/threads/sic-nice-food-west-singapore.6342195/page-232,jurong west,"Jul 23, 2020"
Pets Inner Circle,"Help! Have You Seen SCUTTLE, a Missing Parrot, Lost at Jurong West?",https://forums.hardwarezone.com.sg/threads/help-have-you-seen-scuttle-a-missing-parrot-lost-at-jurong-west.6806865/,jurong west,"Sep 9, 2022"
Eat-Drink-Man-Woman,Hit-and-run at the carpark near Block 964 Jurong West Street 93,https://forums.hardwarezone.com.sg/threads/hit-and-run-at-the-carpark-near-block-964-jurong-west-street-93.6727822/,jurong west,"Apr 6, 2022"
Eat-Drink-Man-Woman,"Python Tries To Swallow Jurong West Community Cat Halfway & Leaves, Public Urged To Keep A Lookout",https://forums.hardwarezone.com.sg/threads/python-tries-to-swallow-jurong-west-community-cat-halfway-leaves-public-urged-to-keep-a-lookout.6485400/,jurong west,"Mar 19, 2021"
Eat-Drink-Man-Woman,[GLGT] Eh Jurong West Blk 840 really got ghost ah?,https://forums.hardwarezone.com.sg/threads/glgt-eh-jurong-west-blk-840-really-got-ghost-ah.6560734/page-4,jurong west,"Jul 20, 2021"
Eat-Drink-Man-Woman,"Ghostly Figure Spotted In Jurong West, Netizens Wonder If 7th Month Came Early",https://forums.hardwarezone.com.sg/threads/ghostly-figure-spotted-in-jurong-west-netizens-wonder-if-7th-month-came-early.6685603/,jurong west,"Jan 26, 2022"
Eat-Drink-Man-Woman,SIC : nice food west Singapore,https://forums.hardwarezone.com.sg/threads/sic-nice-food-west-singapore.6342195/page-2,jurong west,"Jul 23, 2020"
Pets Inner Circle,"Have you seen 'Daniel', a Missing Cat Lost in Jurong West?",https://forums.hardwarezone.com.sg/threads/have-you-seen-daniel-a-missing-cat-lost-in-jurong-west.4576955/,jurong west,"Feb 14, 2014"
Pets Inner Circle,"Have you Seen ""Chinta"" a Missing Cat Lost at Jurong West?",https://forums.hardwarezone.com.sg/threads/have-you-seen-chinta-a-missing-cat-lost-at-jurong-west.4539455/,jurong west,"Jan 13, 2014"
Eat-Drink-Man-Woman,Kallang Blue Tent ⛺️⛺️,https://forums.hardwarezone.com.sg/threads/kallang-blue-tent.6762398/,kallang/whampoa,"Jun 9, 2022"
Eat-Drink-Man-Woman,Human skeleton found under Kallang Bahru bridge remains unidentified despite investigations: Coroner,https://forums.hardwarezone.com.sg/threads/human-skeleton-found-under-kallang-bahru-bridge-remains-unidentified-despite-investigations-coroner.6677788/,kallang/whampoa,"Jan 12, 2022"
HomeSeekers and HomeMakers,Will kallang residences be the first 4rm HDB to mop at $1million,https://forums.hardwarezone.com.sg/threads/will-kallang-residences-be-the-first-4rm-hdb-to-mop-at-1million.6502860/page-4,kallang/whampoa,"Apr 25, 2021"
HomeSeekers and HomeMakers,Will kallang residences be the first 4rm HDB to mop at $1million,https://forums.hardwarezone.com.sg/threads/will-kallang-residences-be-the-first-4rm-hdb-to-mop-at-1million.6502860/post-133715048,kallang/whampoa,"Apr 25, 2021"
HomeSeekers and HomeMakers,Will kallang residences be the first 4rm HDB to mop at $1million,https://forums.hardwarezone.com.sg/threads/will-kallang-residences-be-the-first-4rm-hdb-to-mop-at-1million.6502860/,kallang/whampoa,"Apr 25, 2021"
Eat-Drink-Man-Woman,Mega cars party at Kallang KFC carpark kena raided by SPF,https://forums.hardwarezone.com.sg/threads/mega-cars-party-at-kallang-kfc-carpark-kena-raided-by-spf.6741179/,kallang/whampoa,"Apr 30, 2022"
Eat-Drink-Man-Woman,Anyone tried Ben’s Yeo newly opened stall at Kallang?,https://forums.hardwarezone.com.sg/threads/anyone-tried-bens-yeo-newly-opened-stall-at-kallang.6612077/page-2,kallang/whampoa,"Oct 2, 2021"
Eat-Drink-Man-Woman,"Next BTO launch in Nov, best plot in kallang",https://forums.hardwarezone.com.sg/threads/next-bto-launch-in-nov-best-plot-in-kallang.6801855/page-2,kallang/whampoa,"Aug 30, 2022"
Eat-Drink-Man-Woman,McD Kallang (Stadium) is temporarily closed for deep-cleaning till further notice,https://forums.hardwarezone.com.sg/threads/mcd-kallang-stadium-is-temporarily-closed-for-deep-cleaning-till-further-notice.6532469/,kallang/whampoa,"Jun 7, 2021"
HomeSeekers and HomeMakers,[Official] Feb 2019 Kallang Breeze / Towner Crest thread,https://forums.hardwarezone.com.sg/threads/official-feb-2019-kallang-breeze-towner-crest-thread.6012768/,kallang/whampoa,"Mar 19, 2019"
Eat-Drink-Man-Woman,New 'first-class' Kallang Tennis Centre to be ready by end-2022,https://forums.hardwarezone.com.sg/threads/new-first-class-kallang-tennis-centre-to-be-ready-by-end-2022.6474743/,kallang/whampoa,"Mar 1, 2021"
Eat-Drink-Man-Woman,Got cosplay event at kallang wave mall?,https://forums.hardwarezone.com.sg/threads/got-cosplay-event-at-kallang-wave-mall.6787180/,kallang/whampoa,"Jul 30, 2022"
